{
  "$schema": "https://json-schema.org/draft/2020-12/schema",
  "$id": "https://drupilot.dev/schemas/php-polyfills.schema.json",
  "title": "drupilot PHP polyfills (config/php/polyfills.json)",
  "description": "The functions each symfony/polyfill-phpXY package a Drupal core release can require defines, at the lowest version core requires. Only the unconditional functions are counted on (scripts/lib/plan.sh core_range_polyfills).",
  "type": "object",
  "required": ["schema_version", "as_of", "packages"],
  "additionalProperties": false,
  "properties": {
    "schema_version": {"const": 1},
    "as_of": {"type": "string", "pattern": "^[0-9]{4}-[0-9]{2}-[0-9]{2}$"},
    "_comment": {"type": "string"},
    "packages": {
      "type": "object",
      "propertyNames": {"pattern": "^symfony/polyfill-php[0-9]+$"},
      "additionalProperties": {
        "type": "object",
        "required": ["php", "min_version", "functions", "conditional", "src", "verified"],
        "additionalProperties": false,
        "properties": {
          "php": {"description": "The PHP version whose functions the package provides below it.", "type": "string", "pattern": "^[0-9]+\\.[0-9]+$"},
          "min_version": {"description": "The lowest package version a Drupal core release requires (its bootstrap was read at that tag).", "type": "string", "pattern": "^[0-9]+\\.[0-9]+\\.[0-9]+$"},
          "functions": {"description": "Defined unconditionally on every PHP below php.", "type": "array", "items": {"type": "string", "pattern": "^[a-z_][a-z0-9_]*$"}},
          "conditional": {"description": "Defined only when an extension core does not require is loaded: never counted on.", "type": "object", "additionalProperties": {"type": "array", "items": {"type": "string"}}},
          "src": {"type": "string", "minLength": 1},
          "verified": {"type": "boolean"}
        }
      }
    }
  }
}
